id,question,answer
0,Is  Disability  Insurance  Required  By  Law?,"Not generally. There are five states that require most all employers carry short term disability insurance on their employees. These states are: California, Hawaii, New Jersey, New York, and Rhode Island. Besides this mandatory short term disability law, there is no other legislative imperative for someone to purchase or be covered by disability insurance."
1,Can  Creditors  Take  Life  Insurance  After  Death?,"If the person who passed away was the one with the debt, creditors generally cannot take the life insurance proceeds left as long as the beneficiary was a person. The money then belongs to that beneficiary, and as long as creditors do not have a claim against the beneficiary, they cannot take life insurance proceeds from them."
2,Does  Travelers  Insurance  Have  Renters  Insurance?,"One of the insurance carriers I represent is Travelers and yes, you can purchase Renters insurance through Travelers. I would look for a local agent who can assist you in placing a renters policy if you are interested. I am sure the local agent would be happy to quote Travelers if they have access and other carries as well."
3,Can  I  Drive  A  New  Car  Home  Without  Insurance?,"Most auto dealers will not let you drive the car off of the lot unless you have proof of insurance if there is a loan on the car. It is never a good idea to drive a car without insurance. If you traded a car in, then the coverage on the older car may extend to the new car temporarily, but you need to call your agent as soon as possible and get it changed. Most dealerships have an insurance agent they work with who can get you coverage as well."
,Is  The  Cash  Surrender  Value  Of  Life  Insurance  Taxable?,"Cash surrender value comes only with Whole Life Insurance, never with Term. It is the amount you can terminate your policy and receive. That amount includes both what you put in and what profit you made. The profit is taxable, just as most profit would be taxable. A far better idea would be NOT to surrender your Whole Life Policy, but instead to keep it and borrow against it and either then not repay it or choose to repay it as you wish. You continue to grow in value, even when the loan is out, and your policy stays in force, although the death benefit is reduced by the loan until it is paid back. There are numerous option you should discuss with a qualified agent. Gary Lane, Registered Representative, New York Life, 949 797 2424. Call anytime. Thank you."
5,How  Is  Annuity  Income  Reported?,"The good news is that annuity income is usually reported by the insurance company issuing the annuity. When they make a disbursement they also issue appropriate documentation to assist in filing your taxes. They send identical information to the Internal Revenue Service. Generally speaking when money is withdrawn from an annuity it is treated as interest and then taxed as ordinary income until the interest is exhausted and only the basis (the sum of premiums paid) remains. That money can be recovered free of income tax. If the annuity is annuitized, that is paid out in monthly installments either over an extended period of time or the lifetime of the annuitant, then an exclusion factor is determined and applied to each payment. A part of each payment will be taxed as ordinary income. The bad news is that these principles apply to non-qualified annuities held by individuals and these barely touch all the situations that can arise and the taxation of those unique situations. While this response is not meant to take the place of legal and accounting professional advice it should alert you to some of the complexities of taxing annuities. The most obvious situation is when an annuity is held as an asset of qualified pension plan. This includes defined benefit plans; defined contribution plans (401(k), IRAs and many others. The income taken by these plans is taxed as ordinary income unless it is taken prior to age fifty-nine and a half. If taken earlier it could be subject to a penalty tax of an additional ten per cent. Where annuities taxation becomes complex is when deferred annuities are transferred. That is when a person gives another person an annuity on their life, or the life of a third party. The basic rule is that the transfer is treated as surrender and taxed accordingly. The annuity that is transferred is treated as having been fully paid. It then has a basis of the value that was taxed. For estate planning reasons the ownership of an annuity is sometimes held by a trust and this leads to another set of taxation considerations involving the non-natural person rule. Who is going to be taxed is the basic issue and this can be quite tangled. Of course there are exceptions to all of these rules. Taxation is fairly straightforward if the annuity is annuitized. State laws concerning probate can create some unexpected outcomes and taxation. When an individual owns an annuity and the annuitant is another person, perhaps a spouse, the death of the owner triggers the beneficiary provision and another third person could suddenly own the contract upsetting the intentions of the couple, even if it is a child. Many of the taxation rules are specific to individual insurance companies and it is wise to carefully make sure that the company you select from whom to purchase the annuity follows the procedures that will maintain your plan and keep taxation as uncomplicated as possible. Absent all other plans, the IRS frequently calls for a liquidation of a transferred annuity within five years. The key is the desire to get the tax question settled."
6,What  Does  AAA  Home  Insurance  Cover?,"AAA Home insurance, like all other major carriers, covers a wide variety of claims, including fire, theft, vandalism, and many other items. However, there are numerous types of policies offered, so it is best to determine the type of policy you have to accurately understand all of the benefits. An experienced broker can help."
7,What  Is  A  Simple  Retirement  Plan?,"what is a SIMPLE retirement plan? A Simple is an inexpensive opportunity for a small business to have a retirement plan that doesn't break the bank in advisor fees. A Simple plan is an IRS approved plan with only a few steps to follow so expensive testing and record keeping aren't necessary. For any small business who are considering a retirement plan to offer, this should be right on top as it does provide a great platform for a business who would rather use it's money to put towards employees retirements rather than third party administers plans."
